{"displayBands":{"highMinimum":0.7,"mediumMinimum":0.4},"eligibility":{"maximumUnknownCategories":2,"minimumLeafSupport":20},"evaluation":{"brier":0.205708,"prAuc":0.652023,"precisionAt20":0.625,"recallAt20":0.25},"featureSchemaId":"kuzushi-review-yield-features-v1","labelPolicyId":"kuzushi-review-yield-labels-v1","modelId":"blake3:18655b7ee138903ea277aeefbd926ec771f2a3c9024228302d99e86a5b61df10","modelKind":"decision_tree","nodes":[{"feature":"evidenceCount","id":0,"left":1,"missingDirection":"ineligible","nodeType":"numeric","right":2,"threshold":2.5},{"credibleInterval95":[0.122822,0.3344],"entropyBits":0.749595,"id":1,"negativeCount":44,"nodeType":"leaf","positiveCount":12,"smoothedPositiveRate":0.219298},{"credibleInterval95":[0.695925,0.929356],"entropyBits":0.639457,"id":2,"negativeCount":6,"nodeType":"leaf","positiveCount":31,"smoothedPositiveRate":0.828947}],"schemaVersion":1,"taskId":"review_yield_predecision_v1","training":{"criterion":"entropy","datasetDigest":"blake3:0000000000000000000000000000000000000000000000000000000000000000","maxDepth":4,"minSamplesLeaf":20,"randomSeed":6601,"trainingCutoffSeq":9000}}