{"displayBands":{"highMinimum":0.7,"mediumMinimum":0.4},"eligibility":{"maximumUnknownCategories":2,"minimumLeafSupport":20},"evaluation":{"brier":0.18,"prAuc":0.71,"precisionAt20":0.75,"recallAt20":0.3},"featureSchemaId":"kuzushi-review-yield-features-v1","labelPolicyId":"kuzushi-review-yield-labels-v1","modelId":"blake3:e27942a594da273cb23dcd3a9fc17193537f8b1d0df01056a62f25a83c1a1ee5","modelKind":"decision_tree","nodes":[{"branches":{"code_cited":1,"signal_only":2,"source_sink_linked":1,"statically_confirmed":2},"feature":"staticProofState","id":0,"missingDirection":"ineligible","nodeType":"categorical"},{"feature":"evidenceCount","id":1,"left":3,"missingDirection":"left","nodeType":"numeric","right":4,"threshold":3.5},{"feature":"maxEvidenceConfidence","id":2,"left":5,"missingDirection":"ineligible","nodeType":"numeric","right":6,"threshold":200.0},{"credibleInterval95":[0.076898,0.255876],"entropyBits":0.60984,"id":3,"negativeCount":51,"nodeType":"leaf","positiveCount":9,"smoothedPositiveRate":0.155738},{"credibleInterval95":[0.65777,0.879645],"entropyBits":0.752212,"id":4,"negativeCount":11,"nodeType":"leaf","positiveCount":40,"smoothedPositiveRate":0.778846},{"credibleInterval95":[0.075942,0.529191],"entropyBits":0.811278,"id":5,"negativeCount":9,"nodeType":"leaf","positiveCount":3,"smoothedPositiveRate":0.269231},{"credibleInterval95":[0.69121,0.878679],"entropyBits":0.727687,"id":6,"negativeCount":14,"nodeType":"leaf","positiveCount":55,"smoothedPositiveRate":0.792857}],"schemaVersion":1,"taskId":"review_yield_predecision_v1","training":{"criterion":"entropy","datasetDigest":"blake3:1111111111111111111111111111111111111111111111111111111111111111","maxDepth":3,"minSamplesLeaf":10,"randomSeed":6601,"trainingCutoffSeq":12000}}